{
  "id": "2026-10-23-star-of-bethnal-green-sam-redmore",
  "category": "nights-music",
  "subcategory": "dj-bar",
  "title": "Sam Redmore",
  "venue": {
    "venue_id": "star-of-bethnal-green",
    "name": "The Star of Bethnal Green",
    "address": null,
    "postcode": null
  },
  "starts_at": "2026-10-23T21:00:00+01:00",
  "ends_at": "2026-10-24T02:00:00+01:00",
  "recurrence": null,
  "run_schedule": null,
  "zone": "core",
  "worth_the_trip": false,
  "lineup": [
    "Sam Redmore"
  ],
  "genres": [
    "funk",
    "disco",
    "house",
    "broken beat",
    "afrobeat",
    "latin"
  ],
  "price": {
    "known": true,
    "is_free": true,
    "min_gbp": 0,
    "max_gbp": 0,
    "notes": "Price Free (ma.to)"
  },
  "ticket_url": "https://ma.to/event/sam-redmore-the-star-of-bethnal-green-23-oct-2026",
  "age_restriction": null,
  "accessibility": null,
  "status": "scheduled",
  "evidence": [
    {
      "fields": [
        "title",
        "ticket_url"
      ],
      "url": "https://ma.to/event/sam-redmore-the-star-of-bethnal-green-23-oct-2026",
      "quote": "Sam Redmore at The Star Of Bethnal Green in London | Mato",
      "retrieved_at": "2026-10-13T01:00:00+01:00",
      "source_kind": "aggregator"
    },
    {
      "fields": [
        "starts_at",
        "ends_at"
      ],
      "url": "https://ma.to/event/sam-redmore-the-star-of-bethnal-green-23-oct-2026",
      "quote": "Friday, 23 October 21:00-02:00",
      "retrieved_at": "2026-10-13T01:00:00+01:00",
      "source_kind": "aggregator"
    },
    {
      "fields": [
        "price"
      ],
      "url": "https://ma.to/event/sam-redmore-the-star-of-bethnal-green-23-oct-2026",
      "quote": "Price Free",
      "retrieved_at": "2026-10-13T01:00:00+01:00",
      "source_kind": "aggregator"
    },
    {
      "fields": [
        "venue"
      ],
      "url": "https://ma.to/event/sam-redmore-the-star-of-bethnal-green-23-oct-2026",
      "quote": "Where The Star Of Bethnal Green",
      "retrieved_at": "2026-10-13T01:00:00+01:00",
      "source_kind": "aggregator"
    },
    {
      "fields": [
        "lineup"
      ],
      "url": "https://ma.to/event/sam-redmore-the-star-of-bethnal-green-23-oct-2026",
      "quote": "Sam Redmore brings his versatile selection to The Star of Bethnal Green.",
      "retrieved_at": "2026-10-13T01:00:00+01:00",
      "source_kind": "aggregator"
    },
    {
      "fields": [
        "genres"
      ],
      "url": "https://ma.to/event/sam-redmore-the-star-of-bethnal-green-23-oct-2026",
      "quote": "Known for a style that spans funk, disco, house, and broken beat through to afrobeat and latin sounds",
      "retrieved_at": "2026-10-13T01:00:00+01:00",
      "source_kind": "aggregator"
    }
  ],
  "verification": {
    "verified_at": "2026-10-13T09:40:00+01:00",
    "run_id": "2026-10-13-v",
    "outcome": "verified",
    "removed_fields": [],
    "record": "data/verification/2026-10-13/2026-10-23-star-of-bethnal-green-sam-redmore.json"
  },
  "editor_note": null,
  "listing": {
    "headline": null,
    "blurb": "Sam Redmore on the decks at The Star of Bethnal Green, with a billing that takes in funk, disco, house, broken beat, afrobeat and latin. Free entry, so easy to drop into.",
    "written_at": "2026-10-14T14:36:57+01:00",
    "run_id": "2026-10-14-lw"
  },
  "first_seen": "2026-10-13T09:40:00+01:00",
  "updated_at": "2026-10-13T09:40:00+01:00",
  "history": [],
  "needs_review": null
}
