{
  "id": "2026-10-07-whitechapel-gallery-screen-portraits-whitechapel-gallery-artists-part-2",
  "category": "arts",
  "subcategory": "exhibition",
  "title": "Screen Portraits: Whitechapel Gallery Artists – Part 2",
  "venue": {
    "venue_id": "whitechapel-gallery",
    "name": "Whitechapel Gallery",
    "address": "77-82 Whitechapel High St",
    "postcode": "E1 7QX"
  },
  "starts_at": "2026-10-07",
  "ends_at": "2027-01-17",
  "recurrence": null,
  "run_schedule": "Monday CLOSED, Tuesday 11am-6pm, Wednesday 11am-6pm, Thursday 11am-9pm, Friday 11am-6pm, Saturday 11am-6pm, Sunday 11am-6pm",
  "zone": "fringe",
  "worth_the_trip": false,
  "lineup": [],
  "genres": [],
  "price": {
    "known": false
  },
  "ticket_url": "https://www.whitechapelgallery.org/exhibitions/",
  "age_restriction": null,
  "accessibility": null,
  "status": "scheduled",
  "evidence": [
    {
      "fields": [
        "title",
        "starts_at",
        "ends_at",
        "ticket_url"
      ],
      "url": "https://www.whitechapelgallery.org/exhibitions/",
      "quote": "Screen Portraits: Whitechapel Gallery Artists – Part 2\n7 Oct - 17 Jan 2027",
      "retrieved_at": "2026-10-13T01:00:00+01:00",
      "source_kind": "primary"
    },
    {
      "fields": [
        "run_schedule"
      ],
      "url": "https://www.whitechapelgallery.org/visit/",
      "quote": "Monday CLOSED Tuesday 11am-6pm Wednesday 11am-6pm Thursday 11am-9pm Friday 11am-6pm Saturday 11am-6pm Sunday 11am-6pm",
      "retrieved_at": "2026-10-13T01:00:00+01:00",
      "source_kind": "primary"
    },
    {
      "fields": [
        "venue"
      ],
      "url": "https://www.whitechapelgallery.org/visit/",
      "quote": "77-82 Whitechapel High St London E1 7QX",
      "retrieved_at": "2026-10-13T01:00:00+01:00",
      "source_kind": "primary"
    }
  ],
  "verification": {
    "verified_at": "2026-10-13T09:40:00+01:00",
    "run_id": "2026-10-13-v",
    "outcome": "verified",
    "removed_fields": [],
    "record": "data/verification/2026-10-13/2026-10-07-whitechapel-gallery-screen-portraits-whitechapel-gallery-artists-part-2.json"
  },
  "editor_note": null,
  "listing": null,
  "first_seen": "2026-10-13T09:40:00+01:00",
  "updated_at": "2026-10-13T09:40:00+01:00",
  "history": [],
  "needs_review": null
}
