{
  "id": "2026-10-31-george-tavern-pzyk-gurls-halloween-clubnight",
  "category": "nights-music",
  "subcategory": "club-night",
  "title": "Pzyk Gürls Halloween Clubnight",
  "venue": {
    "venue_id": "george-tavern",
    "name": "The George Tavern",
    "address": null,
    "postcode": null
  },
  "starts_at": "2026-10-31T23:30:00+00:00",
  "ends_at": "2026-11-01T03:30:00+00:00",
  "recurrence": null,
  "run_schedule": null,
  "zone": "fringe",
  "worth_the_trip": false,
  "lineup": [],
  "genres": [],
  "price": {
    "known": true,
    "is_free": false,
    "min_gbp": 8,
    "max_gbp": null,
    "notes": "£8 on the DICE venue listing"
  },
  "ticket_url": "https://dice.fm/venue/the-george-tavern-kx88",
  "age_restriction": null,
  "accessibility": null,
  "status": "scheduled",
  "evidence": [
    {
      "fields": [
        "title",
        "starts_at",
        "ticket_url"
      ],
      "url": "https://dice.fm/venue/the-george-tavern-kx88",
      "quote": "Pzyk Gürls Halloween Clubnight Sat 31 Oct",
      "retrieved_at": "2026-10-13T01:00:00+01:00",
      "source_kind": "primary"
    },
    {
      "fields": [
        "venue",
        "price"
      ],
      "url": "https://dice.fm/venue/the-george-tavern-kx88",
      "quote": "Pzyk Gürls Halloween Clubnight Sat 31 Oct The George Tavern London £8",
      "retrieved_at": "2026-10-13T01:00:00+01:00",
      "source_kind": "primary"
    },
    {
      "fields": [
        "starts_at",
        "ends_at"
      ],
      "url": "https://dice.fm/venue/the-george-tavern-kx88",
      "quote": "Pzyk Gürls Halloween Clubnight 2026-10-31T23:30:00+00:00 2026-11-01T03:30:00+00:00",
      "retrieved_at": "2026-10-13T01:00:00+01:00",
      "source_kind": "primary"
    }
  ],
  "verification": {
    "verified_at": "2026-10-13T09:40:00+01:00",
    "run_id": "2026-10-13-v",
    "outcome": "verified",
    "removed_fields": [],
    "record": "data/verification/2026-10-13/2026-10-31-george-tavern-pzyk-gurls-halloween-clubnight.json"
  },
  "editor_note": null,
  "listing": {
    "headline": null,
    "blurb": "A Halloween club night at The George Tavern under the Pzyk Gürls name, a walk out from Bethnal Green for a proper late one.",
    "written_at": "2026-10-13T02:00:00+01:00",
    "run_id": "2026-10-13-lw2"
  },
  "first_seen": "2026-10-13T09:40:00+01:00",
  "updated_at": "2026-10-13T09:40:00+01:00",
  "history": [],
  "needs_review": null
}
