{
  "id": "2026-10-24-oslo-hackney-locomotive-disco-house-disco-funk-boogie",
  "category": "nights-music",
  "subcategory": "club-night",
  "title": "Locomotive Disco - House, Disco, Funk & Boogie",
  "venue": {
    "venue_id": "oslo-hackney",
    "name": "Oslo Hackney",
    "address": "1A Amhurst Rd, London",
    "postcode": "E8 1LL"
  },
  "starts_at": "2026-10-24T21:00:00+01:00",
  "ends_at": "2026-10-25T03:00:00+00:00",
  "recurrence": null,
  "run_schedule": null,
  "zone": "outer",
  "worth_the_trip": true,
  "lineup": [],
  "genres": [],
  "price": {
    "known": true,
    "is_free": false,
    "min_gbp": 0,
    "max_gbp": null,
    "notes": "From free"
  },
  "ticket_url": null,
  "age_restriction": null,
  "accessibility": null,
  "status": "scheduled",
  "evidence": [
    {
      "fields": [
        "title"
      ],
      "url": "https://dice.fm/venue/oslo-hackney-je6z",
      "quote": "Locomotive Disco - House, Disco, Funk & Boogie",
      "retrieved_at": "2026-10-15T06:20:00+01:00",
      "source_kind": "primary"
    },
    {
      "fields": [
        "starts_at"
      ],
      "url": "https://dice.fm/venue/oslo-hackney-je6z",
      "quote": "\"startDate\":\"2026-10-24T21:00:00+01:00\"",
      "retrieved_at": "2026-10-15T06:20:00+01:00",
      "source_kind": "primary"
    },
    {
      "fields": [
        "ends_at"
      ],
      "url": "https://dice.fm/venue/oslo-hackney-je6z",
      "quote": "\"endDate\":\"2026-10-25T03:00:00+00:00\"",
      "retrieved_at": "2026-10-15T06:20:00+01:00",
      "source_kind": "primary"
    },
    {
      "fields": [
        "venue"
      ],
      "url": "https://dice.fm/venue/oslo-hackney-je6z",
      "quote": "Oslo Hackney",
      "retrieved_at": "2026-10-15T06:20:00+01:00",
      "source_kind": "primary"
    },
    {
      "fields": [
        "price"
      ],
      "url": "https://dice.fm/venue/oslo-hackney-je6z",
      "quote": "Oslo HackneyLondon\nFrom free",
      "retrieved_at": "2026-10-15T06:20:00+01:00",
      "source_kind": "primary"
    }
  ],
  "verification": {
    "verified_at": "2026-10-15T09:30:00+01:00",
    "run_id": "2026-10-15-v",
    "outcome": "verified",
    "removed_fields": [],
    "record": "data/verification/2026-10-15/2026-10-24-oslo-hackney-locomotive-disco-house-disco-funk-boogie.json"
  },
  "editor_note": "Locomotive Disco night at Oslo Hackney, listed on DICE as house, disco, funk and boogie from 21:00.",
  "listing": {
    "headline": null,
    "blurb": "A club night at Oslo Hackney playing house, disco, funk and boogie, with entry starting from free. One for dancing late in the old station building.",
    "written_at": "2026-10-15T07:40:00+01:00",
    "run_id": "2026-10-15-lw"
  },
  "story": null,
  "story_research": null,
  "first_seen": "2026-10-15T09:30:00+01:00",
  "updated_at": "2026-10-15T09:30:00+01:00",
  "history": [],
  "needs_review": null
}
