{
  "id": "2026-10-16-star-of-bethnal-green-jubel-dj-crooks-goons",
  "category": "nights-music",
  "subcategory": "dj-bar",
  "title": "Jubel: DJ Crooks & Goons",
  "venue": {
    "venue_id": "star-of-bethnal-green",
    "name": "The Star of Bethnal Green",
    "address": null,
    "postcode": null
  },
  "starts_at": "2026-10-16T20:00:00+01:00",
  "ends_at": "2026-10-17T02:00:00+01:00",
  "recurrence": null,
  "run_schedule": null,
  "zone": "core",
  "worth_the_trip": false,
  "lineup": [
    "DJ Crooks & Goons"
  ],
  "genres": [],
  "price": {
    "known": false
  },
  "ticket_url": "https://ma.to/event/jubel-dj-crooks-goons-16-oct-2026",
  "age_restriction": null,
  "accessibility": null,
  "status": "scheduled",
  "evidence": [
    {
      "fields": [
        "title",
        "ticket_url"
      ],
      "url": "https://ma.to/event/jubel-dj-crooks-goons-16-oct-2026",
      "quote": "Jubel: DJ Crooks & Goons in London | Mato",
      "retrieved_at": "2026-10-13T01:00:00+01:00",
      "source_kind": "aggregator"
    },
    {
      "fields": [
        "starts_at",
        "ends_at"
      ],
      "url": "https://ma.to/event/jubel-dj-crooks-goons-16-oct-2026",
      "quote": "Friday, 16 October 20:00-02:00",
      "retrieved_at": "2026-10-13T01:00:00+01:00",
      "source_kind": "aggregator"
    },
    {
      "fields": [
        "venue"
      ],
      "url": "https://ma.to/event/jubel-dj-crooks-goons-16-oct-2026",
      "quote": "Where The Star of Bethnal Green",
      "retrieved_at": "2026-10-13T01:00:00+01:00",
      "source_kind": "aggregator"
    },
    {
      "fields": [
        "lineup"
      ],
      "url": "https://ma.to/event/jubel-dj-crooks-goons-16-oct-2026",
      "quote": "Jubel takes over the Friday night slot with DJ Crooks & Goons on the decks.",
      "retrieved_at": "2026-10-13T01:00:00+01:00",
      "source_kind": "aggregator"
    },
    {
      "fields": [
        "ends_at"
      ],
      "url": "https://ma.to/event/jubel-dj-crooks-goons-16-oct-2026",
      "quote": "Music runs until 02:00.",
      "retrieved_at": "2026-10-13T01:00:00+01:00",
      "source_kind": "aggregator"
    }
  ],
  "verification": {
    "verified_at": "2026-10-13T09:40:00+01:00",
    "run_id": "2026-10-13-v",
    "outcome": "verified",
    "removed_fields": [],
    "record": "data/verification/2026-10-13/2026-10-16-star-of-bethnal-green-jubel-dj-crooks-goons.json"
  },
  "editor_note": null,
  "listing": {
    "headline": null,
    "blurb": "A Friday-night DJ session with DJ Crooks & Goons at The Star of Bethnal Green, the local pub known for its private karaoke rooms. It runs until 2am.",
    "written_at": "2026-10-14T14:36:57+01:00",
    "run_id": "2026-10-14-lw"
  },
  "first_seen": "2026-10-13T09:40:00+01:00",
  "updated_at": "2026-10-13T09:40:00+01:00",
  "history": [],
  "needs_review": null
}
