{
  "id": "2026-10-30-colours-hoxton-carabiner-dyke-halloween",
  "category": "nights-music",
  "subcategory": "club-night",
  "title": "Carabiner: Dyke Halloween",
  "venue": {
    "venue_id": "colours-hoxton",
    "name": "Colours Hoxton",
    "address": null,
    "postcode": null
  },
  "starts_at": "2026-10-30T21:00:00+00:00",
  "ends_at": "2026-10-31T02:00:00+00:00",
  "recurrence": null,
  "run_schedule": null,
  "zone": "outer",
  "worth_the_trip": true,
  "lineup": [],
  "genres": [],
  "price": {
    "known": true,
    "is_free": false,
    "min_gbp": 13.89,
    "max_gbp": null,
    "notes": "From £13.89 on the DICE venue listing"
  },
  "ticket_url": "https://dice.fm/venue/colours-hoxton-mxew",
  "age_restriction": null,
  "accessibility": null,
  "status": "scheduled",
  "evidence": [
    {
      "fields": [
        "title",
        "starts_at",
        "price",
        "ticket_url",
        "venue"
      ],
      "url": "https://dice.fm/venue/colours-hoxton-mxew",
      "quote": "Carabiner: Dyke Halloween Fri 30 Oct Colours Hoxton London From £13.89",
      "retrieved_at": "2026-10-13T01:00:00+01:00",
      "source_kind": "primary"
    },
    {
      "fields": [
        "starts_at",
        "ends_at"
      ],
      "url": "https://dice.fm/venue/colours-hoxton-mxew",
      "quote": "Carabiner: Dyke Halloween 2026-10-30T21:00:00+00:00 2026-10-31T02:00:00+00:00",
      "retrieved_at": "2026-10-13T01:00:00+01:00",
      "source_kind": "primary"
    }
  ],
  "verification": {
    "verified_at": "2026-10-13T09:40:00+01:00",
    "run_id": "2026-10-13-v",
    "outcome": "verified",
    "removed_fields": [],
    "record": "data/verification/2026-10-13/2026-10-30-colours-hoxton-carabiner-dyke-halloween.json"
  },
  "editor_note": "A Halloween club night from Carabiner at Colours Hoxton, listed on the venue's DICE page from 21:00.",
  "listing": null,
  "first_seen": "2026-10-13T09:40:00+01:00",
  "updated_at": "2026-10-13T09:40:00+01:00",
  "history": [],
  "needs_review": null
}
