{
  "id": "2026-10-22-george-tavern-kelley-stoltz-scott-lavene",
  "category": "nights-music",
  "subcategory": "gig",
  "title": "Kelley Stoltz + Scott Lavene",
  "venue": {
    "venue_id": "george-tavern",
    "name": "The George Tavern",
    "address": "373 Commercial Rd, London",
    "postcode": "E1 0LA"
  },
  "starts_at": "2026-10-22T19:30:00+01:00",
  "ends_at": "2026-10-22T23:00:00+01:00",
  "recurrence": null,
  "run_schedule": null,
  "zone": "fringe",
  "worth_the_trip": false,
  "lineup": [
    "Kelley Stoltz",
    "Scott Lavene"
  ],
  "genres": [],
  "price": {
    "known": true,
    "is_free": false,
    "min_gbp": 22.1,
    "max_gbp": 22.1,
    "notes": "£22.10 on the DICE venue listing"
  },
  "ticket_url": "https://dice.fm/event/69ba85704182e200014762ea",
  "age_restriction": null,
  "accessibility": null,
  "status": "scheduled",
  "evidence": [
    {
      "fields": [
        "title",
        "starts_at",
        "venue",
        "price"
      ],
      "url": "https://dice.fm/venue/the-george-tavern-kx88",
      "quote": "Kelley Stoltz + Scott Lavene Thu 22 Oct The George Tavern London £22.10",
      "retrieved_at": "2026-10-14T16:58:00+01:00",
      "source_kind": "primary"
    },
    {
      "fields": [
        "starts_at",
        "ends_at"
      ],
      "url": "https://dice.fm/venue/the-george-tavern-kx88",
      "quote": "Kelley Stoltz + Scott Lavene 2026-10-22T19:30:00+01:00 2026-10-22T23:00:00+01:00",
      "retrieved_at": "2026-10-14T16:58:00+01:00",
      "source_kind": "primary"
    },
    {
      "fields": [
        "venue",
        "address",
        "postcode"
      ],
      "url": "https://dice.fm/venue/the-george-tavern-kx88",
      "quote": "373 Commercial Rd, London E1 0LA, UK",
      "retrieved_at": "2026-10-14T16:58:00+01:00",
      "source_kind": "primary"
    },
    {
      "fields": [
        "ticket_url"
      ],
      "url": "https://dice.fm/venue/the-george-tavern-kx88",
      "quote": "https://dice.fm/event/69ba85704182e200014762ea",
      "retrieved_at": "2026-10-14T16:58:00+01:00",
      "source_kind": "primary"
    },
    {
      "fields": [
        "lineup"
      ],
      "url": "https://dice.fm/venue/the-george-tavern-kx88",
      "quote": "Kelley Stoltz + Scott Lavene Thu 22 Oct The George Tavern London £22.10",
      "retrieved_at": "2026-10-14T16:58:00+01:00",
      "source_kind": "primary"
    }
  ],
  "verification": {
    "verified_at": "2026-10-14T17:00:00+01:00",
    "run_id": "2026-10-14-v3",
    "outcome": "verified",
    "removed_fields": [],
    "record": "data/verification/2026-10-14/2026-10-22-george-tavern-kelley-stoltz-scott-lavene.json"
  },
  "editor_note": null,
  "listing": {
    "headline": null,
    "blurb": "A gig at The George Tavern pairing Kelley Stoltz with Scott Lavene, in the pub and live music venue on Commercial Road.",
    "written_at": "2026-10-14T18:00:00+01:00",
    "run_id": "2026-10-14-lw"
  },
  "story": null,
  "story_research": null,
  "first_seen": "2026-10-14T17:00:00+01:00",
  "updated_at": "2026-10-14T17:00:00+01:00",
  "history": [],
  "needs_review": null
}