{
  "id": "2026-10-19-three-colts-tavern-monday-night-open-mic-comedy",
  "category": "arts",
  "subcategory": "comedy",
  "title": "Monday Night Open Mic Comedy",
  "venue": {
    "venue_id": "three-colts-tavern",
    "name": "Three Colts Tavern",
    "address": "199 Cambridge Heath Road",
    "postcode": "E2 0EL"
  },
  "starts_at": "2026-10-19T20:00:00+01:00",
  "ends_at": "2026-10-19T21:30:00+01:00",
  "recurrence": "1st and 3rd Monday of the month",
  "run_schedule": null,
  "zone": "core",
  "worth_the_trip": false,
  "lineup": [],
  "genres": [],
  "price": {
    "known": true,
    "is_free": true,
    "min_gbp": 0,
    "max_gbp": null,
    "notes": "FREE COMEDY NIGHT (listing)"
  },
  "ticket_url": "https://www.designmynight.com/london/bars/bethnal-green/three-colts-tavern/monday-night-open-mic-comedy",
  "age_restriction": null,
  "accessibility": null,
  "status": "scheduled",
  "evidence": [
    {
      "fields": [
        "title",
        "starts_at",
        "ends_at",
        "ticket_url"
      ],
      "url": "https://www.designmynight.com/london/bars/bethnal-green/three-colts-tavern/monday-night-open-mic-comedy",
      "quote": "Monday Night Open Mic Comedy",
      "retrieved_at": "2026-10-13T01:00:00+01:00",
      "source_kind": "aggregator"
    },
    {
      "fields": [
        "starts_at",
        "ends_at"
      ],
      "url": "https://www.designmynight.com/london/bars/bethnal-green/three-colts-tavern/monday-night-open-mic-comedy",
      "quote": "Monday 19th October 2026 and 2 other Mondays\n20:00 - 21:30",
      "retrieved_at": "2026-10-13T01:00:00+01:00",
      "source_kind": "aggregator"
    },
    {
      "fields": [
        "price"
      ],
      "url": "https://www.designmynight.com/london/bars/bethnal-green/three-colts-tavern/monday-night-open-mic-comedy",
      "quote": "FREE COMEDY NIGHT",
      "retrieved_at": "2026-10-13T01:00:00+01:00",
      "source_kind": "aggregator"
    },
    {
      "fields": [
        "venue"
      ],
      "url": "https://www.designmynight.com/london/bars/bethnal-green/three-colts-tavern/monday-night-open-mic-comedy",
      "quote": "Three Colts Tavern, 199 CAMBRIDGE HEATH ROAD,, E2 0EL",
      "retrieved_at": "2026-10-13T01:00:00+01:00",
      "source_kind": "aggregator"
    },
    {
      "fields": [
        "recurrence"
      ],
      "url": "https://www.designmynight.com/london/bars/bethnal-green/three-colts-tavern/monday-night-open-mic-comedy",
      "quote": "We're hosting an open Mic stand-up comedy night 1st and 3rd Monday of the month",
      "retrieved_at": "2026-10-13T01:00:00+01:00",
      "source_kind": "aggregator"
    }
  ],
  "verification": {
    "verified_at": "2026-10-13T09:40:00+01:00",
    "run_id": "2026-10-13-v",
    "outcome": "verified",
    "removed_fields": [],
    "record": "data/verification/2026-10-13/2026-10-19-three-colts-tavern-monday-night-open-mic-comedy.json"
  },
  "editor_note": null,
  "listing": null,
  "first_seen": "2026-10-13T09:40:00+01:00",
  "updated_at": "2026-10-13T09:40:00+01:00",
  "history": [],
  "needs_review": null
}
