{
  "id": "2026-10-23-oxford-house-black-history-month-2026-flower-making-workshop",
  "category": "community",
  "subcategory": "workshop",
  "title": "Black History Month 2026: Flower Making Workshop",
  "venue": {
    "venue_id": "oxford-house",
    "name": "Oxford House",
    "address": null,
    "postcode": "E2 6HG"
  },
  "starts_at": "2026-10-23T17:30:00+01:00",
  "ends_at": null,
  "recurrence": null,
  "run_schedule": null,
  "zone": "core",
  "worth_the_trip": false,
  "lineup": [],
  "genres": [],
  "price": {
    "known": false
  },
  "ticket_url": "https://www.oxfordhouse.org.uk/event/black-history-month-2026-flower-making-workshop/",
  "age_restriction": null,
  "accessibility": null,
  "status": "scheduled",
  "evidence": [
    {
      "fields": [
        "title"
      ],
      "url": "https://www.oxfordhouse.org.uk/event/black-history-month-2026-flower-making-workshop/",
      "quote": "Black History Month 2026: Flower Making Workshop - Oxford House",
      "retrieved_at": "2026-10-13T00:53:00+01:00",
      "source_kind": "primary"
    },
    {
      "fields": [
        "starts_at"
      ],
      "url": "https://www.oxfordhouse.org.uk/event/black-history-month-2026-flower-making-workshop/",
      "quote": "Dates October 23, 2026 - October 23, 2026",
      "retrieved_at": "2026-10-13T00:53:00+01:00",
      "source_kind": "primary"
    },
    {
      "fields": [
        "starts_at"
      ],
      "url": "https://www.oxfordhouse.org.uk/event/black-history-month-2026-flower-making-workshop/",
      "quote": "Times 5:30 pm - 8:00 pm",
      "retrieved_at": "2026-10-13T00:53:00+01:00",
      "source_kind": "primary"
    },
    {
      "fields": [
        "venue"
      ],
      "url": "https://www.oxfordhouse.org.uk/event/black-history-month-2026-flower-making-workshop/",
      "quote": "Location Oxford House, Chapel",
      "retrieved_at": "2026-10-13T00:53:00+01:00",
      "source_kind": "primary"
    },
    {
      "fields": [
        "venue"
      ],
      "url": "https://www.oxfordhouse.org.uk/event/black-history-month-2026-flower-making-workshop/",
      "quote": "London E2 6HG",
      "retrieved_at": "2026-10-13T00:53:00+01:00",
      "source_kind": "primary"
    },
    {
      "fields": [
        "ticket_url"
      ],
      "url": "https://www.oxfordhouse.org.uk/event/black-history-month-2026-flower-making-workshop/",
      "quote": "Black History Month 2026: Flower Making Workshop - Oxford House",
      "retrieved_at": "2026-10-13T00:53:00+01:00",
      "source_kind": "primary"
    }
  ],
  "verification": {
    "verified_at": "2026-10-13T09:40:00+01:00",
    "run_id": "2026-10-13-v",
    "outcome": "verified",
    "removed_fields": [],
    "record": "data/verification/2026-10-13/2026-10-23-oxford-house-black-history-month-2026-flower-making-workshop.json"
  },
  "editor_note": "A small, hands-on craft workshop that is part of Black History Month 2026 at Oxford House.",
  "listing": {
    "headline": null,
    "blurb": "A flower-making workshop in the Black History Month 2026 programme at Oxford House, the Bethnal Green community arts centre. One for anyone who enjoys a hands-on session.",
    "written_at": "2026-10-14T14:36:57+01:00",
    "run_id": "2026-10-14-lw"
  },
  "first_seen": "2026-10-13T09:40:00+01:00",
  "updated_at": "2026-10-13T09:40:00+01:00",
  "history": [],
  "needs_review": null
}
