{
  "id": "2026-10-30-village-underground-batu-all-night-long",
  "category": "nights-music",
  "subcategory": "club-night",
  "title": "Batu (All Night Long)",
  "venue": {
    "venue_id": "village-underground",
    "name": "Village Underground",
    "address": "54 Holywell Lane, London",
    "postcode": "EC2A 3PQ"
  },
  "starts_at": "2026-10-30T23:00:00+00:00",
  "ends_at": "2026-10-31T05:00:00+00:00",
  "recurrence": null,
  "zone": "outer",
  "worth_the_trip": true,
  "lineup": [
    "Batu"
  ],
  "genres": [
    "modernist techno"
  ],
  "price": {
    "known": true,
    "is_free": false,
    "min_gbp": 19,
    "max_gbp": null,
    "notes": null
  },
  "ticket_url": "https://dice.fm/event/avx5n2-batu-all-night-long-30th-oct-village-underground-london-tickets",
  "age_restriction": "18+",
  "accessibility": null,
  "status": "scheduled",
  "evidence": [
    {
      "fields": [
        "title",
        "venue",
        "ticket_url"
      ],
      "url": "https://dice.fm/event/avx5n2-batu-all-night-long-30th-oct-village-underground-london-tickets",
      "quote": "Batu (All Night Long) Tickets | 30 Oct | Village Underground, London | DICE",
      "retrieved_at": "2026-10-14T14:20:00+01:00",
      "source_kind": "primary"
    },
    {
      "fields": [
        "starts_at"
      ],
      "url": "https://dice.fm/event/avx5n2-batu-all-night-long-30th-oct-village-underground-london-tickets",
      "quote": "Fri 30 Oct, 11:00 pm",
      "retrieved_at": "2026-10-14T14:20:00+01:00",
      "source_kind": "primary"
    },
    {
      "fields": [
        "ends_at"
      ],
      "url": "https://dice.fm/event/avx5n2-batu-all-night-long-30th-oct-village-underground-london-tickets",
      "quote": "\"endDate\":\"2026-10-31T05:00:00+00:00\"",
      "retrieved_at": "2026-10-14T14:20:00+01:00",
      "source_kind": "primary"
    },
    {
      "fields": [
        "venue"
      ],
      "url": "https://dice.fm/event/avx5n2-batu-all-night-long-30th-oct-village-underground-london-tickets",
      "quote": "54 Holywell Lane, London EC2A 3PQ, UK",
      "retrieved_at": "2026-10-14T14:20:00+01:00",
      "source_kind": "primary"
    },
    {
      "fields": [
        "lineup"
      ],
      "url": "https://dice.fm/event/avx5n2-batu-all-night-long-30th-oct-village-underground-london-tickets",
      "quote": "{\"@type\":\"PerformingGroup\",\"name\":\"Batu\"",
      "retrieved_at": "2026-10-14T14:20:00+01:00",
      "source_kind": "primary"
    },
    {
      "fields": [
        "genres"
      ],
      "url": "https://dice.fm/event/avx5n2-batu-all-night-long-30th-oct-village-underground-london-tickets",
      "quote": "bringing his distinctive take on modernist techno",
      "retrieved_at": "2026-10-14T14:20:00+01:00",
      "source_kind": "primary"
    },
    {
      "fields": [
        "price"
      ],
      "url": "https://dice.fm/event/avx5n2-batu-all-night-long-30th-oct-village-underground-london-tickets",
      "quote": "\"lowPrice\":\"19.00\",\"highPrice\":\"19.00\"",
      "retrieved_at": "2026-10-14T14:20:00+01:00",
      "source_kind": "primary"
    },
    {
      "fields": [
        "age_restriction"
      ],
      "url": "https://dice.fm/event/avx5n2-batu-all-night-long-30th-oct-village-underground-london-tickets",
      "quote": "This is an 18+ event. Valid ID required.",
      "retrieved_at": "2026-10-14T14:20:00+01:00",
      "source_kind": "primary"
    },
    {
      "fields": [
        "worth_the_trip",
        "why_its_good"
      ],
      "url": "https://dice.fm/event/avx5n2-batu-all-night-long-30th-oct-village-underground-london-tickets",
      "quote": "Timedance label boss & prolific DJ/Producer Batu goes all night long",
      "retrieved_at": "2026-10-14T14:20:00+01:00",
      "source_kind": "primary"
    }
  ],
  "verification": {
    "verified_at": "2026-10-14T16:00:00+01:00",
    "run_id": "2026-10-14-v2",
    "outcome": "verified",
    "removed_fields": [],
    "record": "data/verification/2026-10-14/2026-10-30-village-underground-batu-all-night-long.json"
  },
  "editor_note": "Timedance label boss Batu's all-nighter, from 11pm to 5am, at Village Underground.",
  "listing": {
    "headline": null,
    "blurb": "A modernist techno club night with Batu at Village Underground in Shoreditch, billed as All Night Long and running into the early hours.",
    "written_at": "2026-10-15T07:40:00+01:00",
    "run_id": "2026-10-15-lw"
  },
  "story": null,
  "story_research": null,
  "first_seen": "2026-10-14T16:00:00+01:00",
  "updated_at": "2026-10-14T16:00:00+01:00",
  "history": [],
  "needs_review": null
}