{
  "id": "2026-10-27-museum-of-the-home-light-and-movement-diwali-family-day",
  "category": "community",
  "subcategory": "family",
  "title": "Light and Movement: Diwali Family Day",
  "venue": {
    "venue_id": "museum-of-the-home",
    "name": "Museum of the Home",
    "address": "136 Kingsland Road, London",
    "postcode": "E2 8EA"
  },
  "starts_at": "2026-10-27",
  "ends_at": null,
  "recurrence": null,
  "run_schedule": null,
  "zone": "core",
  "worth_the_trip": false,
  "lineup": [],
  "genres": [],
  "price": {
    "known": false
  },
  "ticket_url": "https://museumofthehome.org.uk/whats-on/",
  "age_restriction": null,
  "accessibility": null,
  "status": "scheduled",
  "evidence": [
    {
      "fields": [
        "title"
      ],
      "url": "https://museumofthehome.org.uk/whats-on/",
      "quote": "Light and Movement: Diwali Family Day",
      "retrieved_at": "2026-10-13T00:53:00+01:00",
      "source_kind": "primary"
    },
    {
      "fields": [
        "starts_at"
      ],
      "url": "https://museumofthehome.org.uk/whats-on/",
      "quote": "Tuesday 27 October 2026",
      "retrieved_at": "2026-10-13T00:53:00+01:00",
      "source_kind": "primary"
    },
    {
      "fields": [
        "venue"
      ],
      "url": "https://museumofthehome.org.uk/whats-on/",
      "quote": "136 Kingsland Road",
      "retrieved_at": "2026-10-13T00:53:00+01:00",
      "source_kind": "primary"
    },
    {
      "fields": [
        "venue"
      ],
      "url": "https://museumofthehome.org.uk/whats-on/",
      "quote": "London E2 8EA",
      "retrieved_at": "2026-10-13T00:53:00+01:00",
      "source_kind": "primary"
    },
    {
      "fields": [
        "ticket_url"
      ],
      "url": "https://museumofthehome.org.uk/whats-on/",
      "quote": "Light and Movement: Diwali Family Day",
      "retrieved_at": "2026-10-13T00:53:00+01:00",
      "source_kind": "primary"
    }
  ],
  "verification": {
    "verified_at": "2026-10-13T09:40:00+01:00",
    "run_id": "2026-10-13-v",
    "outcome": "verified",
    "removed_fields": [],
    "record": "data/verification/2026-10-13/2026-10-27-museum-of-the-home-light-and-movement-diwali-family-day.json"
  },
  "editor_note": "A drop-in Diwali family day at the museum with creative activities and performances.",
  "listing": {
    "headline": null,
    "blurb": "A Diwali family day at the Museum of the Home, themed around light and movement. One to pencil in if you're after something to do with the children.",
    "written_at": "2026-10-14T14:36:57+01:00",
    "run_id": "2026-10-14-lw"
  },
  "first_seen": "2026-10-13T09:40:00+01:00",
  "updated_at": "2026-10-13T09:40:00+01:00",
  "history": [],
  "needs_review": null
}
